,MovieName,Star1,Star2,Star3,Star4,Genre1,Genre2,Genre3,Gross_Collection,Certification,votes
411,The Hitcher, Rutger Hauer, C. Thomas Howell, Jennifer Jason Leigh, Jeffrey DeMunn,Action, Mystery, Thriller,5.84,R ,"50,119"
412,Bajirao Mastani, Ranveer Singh, Deepika Padukone, Priyanka Chopra Jonas, Tanvi Azmi,Action, Drama, History,6.56,Not Rated ,"36,872"
413,Magnum Force, Clint Eastwood, Hal Holbrook, Mitchell Ryan, David Soul,Action, Crime, Mystery,4.56,R ,"64,085"
414,The Siege of Jadotville, Richard Lukunku, Danny Sapani, Andrew Stock, Mark Strong,Action, Drama, History,Nan,TV-MA ,"41,843"
415,Django, Franco Nero, José Canalejas, José Bódalo, Loredana Nusciak,Action, Drama, Western,0.03,Not Rated ,"29,343"
416,The Witcher: Nightmare of the Wolf, Theo James, Mary McDonnell, Lara Pulver, Graham McTavish,Animation, Action, Adventure,Nan,TV-MA ,"47,101"
417,Arlington Road, Jeff Bridges, Tim Robbins, Joan Cusack, Hope Davis,Action, Crime, Drama,24.36,R ,"89,097"
418,The Transformers: The Movie, Orson Welles, Robert Stack, Leonard Nimoy, Norman Alden,Animation, Action, Adventure,5.85,PG ,"40,691"
419,'71, Jack O'Connell, Sam Reid, Sean Harris, Paul Popplewell,Action, Crime, Drama,1.27,R ,"58,097"
420,Kon-Tiki, Pål Sverre Hagen, Anders Baasmo, Gustaf Skarsgård, Odd-Magnus Williamson,Action, Adventure, Biography,1.52,PG-13 ,"50,451"
421,Harry Brown, Michael Caine, Emily Mortimer, David Bradley, Charlie Creed-Miles,Action, Crime, Drama,1.82,R ,"89,448"
422,Fist of Fury, Bruce Lee, Nora Miao, James Tien, Maria Yi,Action, Drama, Romance,1.29,R ,"31,988"
423,The Good the Bad the Weird, Song Kang-ho, Lee Byung-hun, Jung Woo-sung, Je-mun Yun,Action, Adventure, Comedy,0.13,R ,"36,747"
424,Marshland, Javier Gutiérrez, Raúl Arévalo, María Varod, Perico Cervantes,Action, Crime, Mystery,Nan,TV-MA ,"35,020"
425,Mongol: The Rise of Genghis Khan, Tadanobu Asano, Amadu Mamadakov, Khulan Chuluun, Honglei Sun,Action, Biography, Drama,5.70,R ,"47,924"
426,Final Fantasy VII: Advent Children, Takahiro Sakurai, Ayumi Ito, Shôtarô Morikubo, Maaya Sakamoto,Animation, Action, Adventure,Nan,PG-13 ,"57,197"
427,Holiday: A Soldier is Never Off Duty, Akshay Kumar, Sonakshi Sinha, Freddy Daruwala, Sumeet Raghavan,Action, Crime, Thriller,0.71,Not Rated ,"29,126"
428,Furious 7, Vin Diesel, Paul Walker, Dwayne Johnson, Jason Statham,Action, Crime, Thriller,353.01,PG-13 ,"399,421"
429,Free Guy, Ryan Reynolds, Jodie Comer, Taika Waititi, Lil Rel Howery,Action, Adventure, Comedy,121.63,PG-13 ,"389,950"
430,Wrath of Man, Jason Statham, Holt McCallany, Josh Hartnett, Rocci Boy Williams,Action, Crime, Thriller,27.47,R ,"189,698"
431,Mission: Impossible, Tom Cruise, Jon Voight, Emmanuelle Béart, Henry Czerny,Action, Adventure, Thriller,180.98,PG-13 ,"438,212"
432,The Mummy, Brendan Fraser, Rachel Weisz, John Hannah, Arnold Vosloo,Action, Adventure, Fantasy,155.25,PG-13 ,"443,380"
433,Man of Steel, Henry Cavill, Amy Adams, Michael Shannon, Diane Lane,Action, Adventure, Sci-Fi,291.05,PG-13 ,"785,581"
434,Prey, Amber Midthunder, Dakota Beavers, Dane DiLiegro, Stormee Kipp,Action, Adventure, Drama,Nan,R ,"206,525"
435,Dredd, Karl Urban, Olivia Thirlby, Lena Headey, Rachel Wood,Action, Crime, Sci-Fi,13.41,R ,"282,383"
436,Shooter, Mark Wahlberg, Michael Peña, Rhona Mitra, Danny Glover,Action, Drama, Thriller,47.00,R ,"341,788"
437,Tropic Thunder, Ben Stiller, Jack Black, Robert Downey Jr., Jeff Kahn,Action, Comedy, War,110.52,R ,"428,838"
438,Snowpiercer, Chris Evans, Jamie Bell, Tilda Swinton, Ed Harris,Action, Drama, Sci-Fi,4.56,R ,"371,504"
439,WarGames, Matthew Broderick, Ally Sheedy, John Wood, Dabney Coleman,Action, Drama, Sci-Fi,79.57,PG ,"104,247"
440,Iron Man 3, Robert Downey Jr., Guy Pearce, Gwyneth Paltrow, Don Cheadle,Action, Adventure, Sci-Fi,409.01,PG-13 ,"868,570"
441,Sicario: Day of the Soldado, Benicio Del Toro, Josh Brolin, Isabela Merced, Jeffrey Donovan,Action, Crime, Drama,50.07,R ,"155,971"
442,We Were Soldiers, Mel Gibson, Madeleine Stowe, Greg Kinnear, Sam Elliott,Action, Drama, History,78.12,R ,"146,374"
443,Blade, Wesley Snipes, Stephen Dorff, Kris Kristofferson, N'Bushe Wright,Action, Horror, Sci-Fi,70.09,R ,"284,157"
444,Batman Returns, Michael Keaton, Danny DeVito, Michelle Pfeiffer, Christopher Walken,Action, Crime, Fantasy,162.83,PG-13 ,"313,435"
445,Desperado, Antonio Banderas, Salma Hayek, Joaquim de Almeida, Cheech Marin,Action, Crime, Thriller,25.63,R ,"190,980"
446,DC League of Super-Pets, Dwayne Johnson, Kevin Hart, Kate McKinnon, John Krasinski,Animation, Action, Adventure,93.66,PG ,"69,137"
447,Highlander, Christopher Lambert, Sean Connery, Clancy Brown, Roxanne Hart,Action, Adventure, Fantasy,5.90,R ,"140,626"
448,American Made, Tom Cruise, Domhnall Gleeson, Sarah Wright, Jesse Plemons,Action, Comedy, Crime,51.34,R ,"193,051"
449,Pirates of the Caribbean: At World's End, Johnny Depp, Orlando Bloom, Keira Knightley, Geoffrey Rush,Action, Adventure, Fantasy,309.42,PG-13 ,"666,330"
450,"I, Robot", Will Smith, Bridget Moynahan, Bruce Greenwood, Alan Tudyk,Action, Mystery, Sci-Fi,144.80,PG-13 ,"554,196"
451,Casualties of War, Michael J. Fox, Sean Penn, Don Harvey, John C. Reilly,Action, Crime, Drama,18.67,R ,"46,211"
452,Kung Fu Panda 3, Jack Black, Bryan Cranston, Dustin Hoffman, Angelina Jolie,Animation, Action, Adventure,143.53,PG ,"169,551"
453,Escape from New York, Kurt Russell, Lee Van Cleef, Ernest Borgnine, Donald Pleasence,Action, Adventure, Sci-Fi,25.24,R ,"148,686"
454,Creed II, Michael B. Jordan, Sylvester Stallone, Tessa Thompson, Phylicia Rashad,Action, Drama, Sport,115.72,PG-13 ,"143,953"
455,The Poseidon Adventure, Gene Hackman, Ernest Borgnine, Shelley Winters, Red Buttons,Action, Adventure, Drama,84.56,PG ,"47,180"
456,Everest, Jason Clarke, Ang Phula Sherpa, Thomas M. Wright, Martin Henderson,Action, Adventure, Biography,43.48,PG-13 ,"223,750"
457,Allied, Brad Pitt, Marion Cotillard, Jared Harris, Vincent Ebrahim,Action, Drama, Romance,40.10,R ,"162,448"
458,Planet Terror, Rose McGowan, Freddy Rodríguez, Josh Brolin, Marley Shelton,Action, Comedy, Horror,Nan,R ,"216,618"
459,No Way Out, Kevin Costner, Gene Hackman, Sean Young, Will Patton,Action, Crime, Drama,35.51,R ,"42,723"
460,Deja Vu, Denzel Washington, Paula Patton, Jim Caviezel, Val Kilmer,Action, Crime, Sci-Fi,64.04,PG-13 ,"317,605"
461,Rocky Balboa, Sylvester Stallone, Antonio Tarver, Milo Ventimiglia, Burt Young,Action, Drama, Sport,70.27,PG ,"224,351"
462,Deepwater Horizon, Mark Wahlberg, Kurt Russell, Douglas M. Griffin, James DuMont,Action, Drama, History,61.43,PG-13 ,"174,007"
463,Three Kings, George Clooney, Mark Wahlberg, Ice Cube, Spike Jonze,Action, Adventure, Comedy,60.65,R ,"175,805"
464,Live Free or Die Hard, Bruce Willis, Justin Long, Timothy Olyphant, Maggie Q,Action, Thriller,Nan,134.53,PG-13 ,"412,262"
465,Die Hard 2, Bruce Willis, William Atherton, Bonnie Bedelia, Reginald VelJohnson,Action, Thriller,Nan,117.54,R ,"370,390"
466,Defiance, Daniel Craig, Liev Schreiber, Jamie Bell, Alexa Davalos,Action, Drama, History,28.64,R ,"151,919"
467,Brawl in Cell Block 99, Vince Vaughn, Jennifer Carpenter, Don Johnson, Udo Kier,Action, Crime, Drama,Nan,Not Rated ,"70,724"
468,Flags of Our Fathers, Ryan Phillippe, Barry Pepper, Joseph Cross, Jesse Bradford,Action, Adventure, Drama,33.60,R ,"126,080"
469,Payback, Mel Gibson, Gregg Henry, Maria Bello, David Paymer,Action, Crime, Drama,81.53,R ,"141,437"
470,Ong-Bak: The Thai Warrior, Tony Jaa, Phetthai Vongkumlao, Pumwaree Yodkamol, Suchao Pongwilai,Action, Crime, Thriller,4.56,R ,"76,349"
471,Mosul, Waleed Elgadi, Suhail Dabbach, Adam Bessa, Is'haq Elias,Action, Drama, War,Nan,TV-MA ,"28,431"
472,District B13, Cyril Raffaelli, David Belle, Tony D'Amario, Bibi Naceri,Action, Crime, Sci-Fi,1.20,R ,"72,012"
473,The Girl Who Played with Fire, Noomi Rapace, Michael Nyqvist, Lena Endre, Peter Andersson,Action, Crime, Drama,9.08,R ,"96,787"
474,God Bless America, Joel Murray, Tara Lynne Barr, Mackenzie Brooke Smith, Melinda Page Hamilton,Action, Comedy, Crime,0.12,R ,"71,019"
475,In Order of Disappearance, Stellan Skarsgård, Bruno Ganz, Pål Sverre Hagen, Jakob Oftebro,Action, Comedy, Crime,0.05,R ,"28,096"
476,Don, Shah Rukh Khan, Priyanka Chopra Jonas, Arjun Rampal, Isha Koppikar,Action, Crime, Thriller,0.80,Not Rated ,"38,873"
477,JCVD, Jean-Claude Van Damme, Valérie Bodson, Hervé Sogne, Rock Chen,Action, Comedy, Crime,0.47,R ,"39,609"
478,Kaabil, Hrithik Roshan, Yami Gautam, Ronit Roy, Rohit Roy,Action, Crime, Drama,Nan,Not Rated ,"27,982"
479,Dragon Ball Z: Battle of Gods, Masako Nozawa, Hiromi Tsuru, Ryô Horikawa, Masaharu Satô,Animation, Action, Adventure,2.55,TV-PG ,"28,899"
480,Micmacs, Dany Boon, André Dussollier, Nicolas Marié, Yolande Moreau,Action, Comedy, Crime,1.26,R ,"30,787"
481,Koi, Hrithik Roshan, Rekha, Preity G Zinta, Rakesh Roshan,Action, Drama, Romance,0.68,Not Rated ,"25,616"
482,Enthiran, Rajinikanth, Aishwarya Rai Bachchan, Danny Denzongpa, Santhanam,Action, Sci-Fi, Thriller,4.37,Not Rated ,"28,635"
483,Fanaa, Aamir Khan, Kajol, Rishi Kapoor, Tabu,Action, Drama, Romance,2.10,Not Rated ,"33,887"
484,Marighella, Seu Jorge, Bruno Gagliasso, Luiz Carlos Vasconcelos, Humberto Carrão,Action, Drama, History,Nan,Nan,"55,572"
485,Gabbar Is Back, Akshay Kumar, Shruti Haasan, Kareena Kapoor, Suman,Action, Crime, Drama,Nan,Not Rated ,"25,758"
486,Fast & Furious 6, Vin Diesel, Paul Walker, Dwayne Johnson, Michelle Rodriguez,Action, Adventure, Crime,238.68,PG-13 ,"403,120"
487,The Unbearable Weight of Massive Talent, Nicolas Cage, Pedro Pascal, Tiffany Haddish, Sharon Horgan,Action, Comedy, Crime,Nan,R ,"122,883"
488,Transformers, Shia LaBeouf, Megan Fox, Josh Duhamel, Tyrese Gibson,Action, Adventure, Sci-Fi,319.25,PG-13 ,"650,989"
489,The Northman, Alexander Skarsgård, Nicole Kidman, Claes Bang, Ethan Hawke,Action, Adventure, Drama,Nan,R ,"227,559"
490,Ant-Man and the Wasp, Paul Rudd, Evangeline Lilly, Michael Peña, Walton Goggins,Action, Adventure, Comedy,216.65,PG-13 ,"424,037"
491,Shazam!, Zachary Levi, Mark Strong, Asher Angel, Jack Dylan Grazer,Action, Adventure, Comedy,140.37,PG-13 ,"362,358"
492,Death Proof, Kurt Russell, Zoë Bell, Rosario Dawson, Vanessa Ferlito,Action, Thriller,Nan,Nan,R ,"300,504"
493,Independence Day, Will Smith, Bill Pullman, Jeff Goldblum, Mary McDonnell,Action, Adventure, Sci-Fi,306.17,PG-13 ,"586,124"
494,Jack Reacher, Tom Cruise, Rosamund Pike, Richard Jenkins, Werner Herzog,Action, Mystery, Thriller,80.07,PG-13 ,"349,610"
495,Super 8, Elle Fanning, AJ Michalka, Kyle Chandler, Joel Courtney,Action, Mystery, Sci-Fi,127.00,PG-13 ,"360,634"
496,Thor, Chris Hemsworth, Anthony Hopkins, Natalie Portman, Tom Hiddleston,Action, Fantasy,Nan,181.03,PG-13 ,"867,219"
497,World War Z, Brad Pitt, Mireille Enos, Daniella Kertesz, James Badge Dale,Action, Adventure, Horror,202.36,PG-13 ,"686,851"
498,Cloverfield, Mike Vogel, Jessica Lucas, Lizzy Caplan, T.J. Miller,Action, Adventure, Horror,80.05,PG-13 ,"408,348"
499,Constantine, Keanu Reeves, Rachel Weisz, Djimon Hounsou, Shia LaBeouf,Action, Fantasy, Horror,75.98,R ,"357,896"
500,Smokey and the Bandit, Burt Reynolds, Sally Field, Jerry Reed, Mike Henry,Action, Adventure, Comedy,126.74,PG ,"53,871"
501,Star Trek Beyond, Chris Pine, Zachary Quinto, Karl Urban, Zoe Saldana,Action, Adventure, Sci-Fi,158.85,PG-13 ,"251,574"
502,Oblivion, Tom Cruise, Morgan Freeman, Andrea Riseborough, Olga Kurylenko,Action, Adventure, Sci-Fi,89.02,PG-13 ,"537,115"
503,Pitch Black, Radha Mitchell, Cole Hauser, Vin Diesel, Keith David,Action, Horror, Sci-Fi,39.24,R ,"246,749"
504,Greyhound, Tom Hanks, Elisabeth Shue, Stephen Graham, Matt Helm,Action, Drama, History,Nan,PG-13 ,"103,107"
505,Rush Hour, Jackie Chan, Chris Tucker, Ken Leung, Tom Wilkinson,Action, Comedy, Crime,141.15,PG-13 ,"278,894"
506,The Italian Job, Donald Sutherland, Mark Wahlberg, Edward Norton, Charlize Theron,Action, Crime, Thriller,106.13,PG-13 ,"376,823"
507,Stargate, Kurt Russell, James Spader, Jaye Davidson, Viveca Lindfors,Action, Adventure, Sci-Fi,71.57,PG-13 ,"196,915"
508,Brotherhood of the Wolf, Samuel Le Bihan, Mark Dacascos, Jérémie Renier, Vincent Cassel,Action, Adventure, Drama,11.26,R ,"68,604"
509,The Last Boy Scout, Bruce Willis, Damon Wayans, Chelsea Field, Noble Willingham,Action, Comedy, Crime,59.51,R ,"107,271"
510,Underworld, Kate Beckinsale, Scott Speedman, Shane Brolly, Michael Sheen,Action, Fantasy, Thriller,51.97,R ,"276,791"
511,RED, Bruce Willis, Helen Mirren, Morgan Freeman, Mary-Louise Parker,Action, Comedy, Crime,90.38,PG-13 ,"315,395"
512,Spy, Melissa McCarthy, Rose Byrne, Jude Law, Jason Statham,Action, Comedy,Nan,110.83,R ,"250,070"
513,Den of Thieves, Gerard Butler, Pablo Schreiber, O'Shea Jackson Jr., 50 Cent,Action, Crime, Drama,44.95,R ,"117,553"
514,Logan Lucky, Channing Tatum, Adam Driver, Daniel Craig, Farrah Mackenzie,Action, Comedy, Crime,27.78,PG-13 ,"155,227"
515,Real Steel, Hugh Jackman, Evangeline Lilly, Dakota Goyo, Anthony Mackie,Action, Drama, Sci-Fi,85.47,PG-13 ,"340,019"
516,Public Enemies, Christian Bale, Johnny Depp, Christian Stolte, Jason Clarke,Action, Biography, Crime,97.10,R ,"309,530"
517,The Towering Inferno, Paul Newman, Steve McQueen, William Holden, Faye Dunaway,Action, Drama, Thriller,116.00,PG ,"45,989"
518,Fallen, Denzel Washington, John Goodman, Donald Sutherland, Embeth Davidtz,Action, Crime, Drama,25.19,R ,"87,001"
519,22 Jump Street, Channing Tatum, Jonah Hill, Ice Cube, Nick Offerman,Action, Comedy, Crime,191.72,R ,"388,757"
520,Rambo, Sylvester Stallone, Julie Benz, Matthew Marsden, Graham McTavish,Action, Adventure, Thriller,42.75,R ,"237,499"
521,Bronson, Tom Hardy, Kelly Adams, Luing Andrews, Katy Barker,Action, Crime, Drama,0.10,R ,"135,611"
522,Chronicle, Dane DeHaan, Alex Russell, Michael B. Jordan, Michael Kelly,Action, Drama, Sci-Fi,64.58,PG-13 ,"256,570"
523,9, Elijah Wood, Jennifer Connelly, Crispin Glover, Christopher Plummer,Animation, Action, Adventure,31.74,PG-13 ,"143,104"
524,Chip 'n Dale: Rescue Rangers, Andy Samberg, John Mulaney, KiKi Layne, Will Arnett,Animation, Action, Adventure,Nan,PG ,"43,524"
525,Hellboy II: The Golden Army, Ron Perlman, Selma Blair, Doug Jones, John Alexander,Action, Adventure, Fantasy,75.75,PG-13 ,"278,207"
526,Body of Lies, Leonardo DiCaprio, Russell Crowe, Mark Strong, Golshifteh Farahani,Action, Drama, Thriller,39.39,R ,"232,868"
527,The Foreigner, Katie Leung, Jackie Chan, Rufus Jones, Mark Tandy,Action, Thriller,Nan,34.39,R ,"118,298"
528,The Kingdom, Jamie Foxx, Chris Cooper, Jennifer Garner, Jason Bateman,Action, Drama, Thriller,47.54,R ,"128,412"
529,A Most Violent Year, Oscar Isaac, Jessica Chastain, David Oyelowo, Alessandro Nivola,Action, Crime, Drama,5.74,R ,"74,766"
530,The Spy Who Loved Me, Roger Moore, Barbara Bach, Curd Jürgens, Richard Kiel,Action, Adventure, Thriller,46.80,PG ,"112,102"
531,Filth, James McAvoy, Jamie Bell, Eddie Marsan, Imogen Poots,Action, Comedy, Crime,0.03,R ,"112,224"
532,Spy Game, Robert Redford, Brad Pitt, Catherine McCormack, Stephen Dillane,Action, Crime, Thriller,0.03,R ,"160,920"
533,Ip Man 4: The Finale, Donnie Yen, Scott Adkins, Danny Kwok-Kwan Chan, Vanness Wu,Action, Biography, Drama,3.96,Not Rated ,"34,405"
534,Son of Rambow, Bill Milner, Will Poulter, Jessica Hynes, Anna Wing,Action, Adventure, Comedy,1.78,PG-13 ,"32,496"
535,Ichi the Killer, Tadanobu Asano, Nao Ômori, Shin'ya Tsukamoto, Paulyn Sun,Action, Crime, Drama,0.02,R ,"57,973"
536,Maverick, Mel Gibson, Jodie Foster, James Garner, Graham Greene,Action, Adventure, Comedy,101.63,PG ,"115,106"
537,Thunderbolt and Lightfoot, Clint Eastwood, Jeff Bridges, George Kennedy, Geoffrey Lewis,Action, Comedy, Crime,25.00,R ,"26,849"
538,Juice, Omar Epps, Tupac Shakur, Jermaine Hopkins, Khalil Kain,Action, Crime, Drama,20.15,R ,"28,560"
539,Unleashed, Jet Li, Bob Hoskins, Morgan Freeman, Kerry Condon,Action, Crime, Drama,24.52,R ,"105,308"
540,An Action Hero, Ayushmann Khurrana, Jaideep Ahlawat, Neeraj Madhav, Gautam Joglekar,Action, Comedy, Crime,Nan,U ,"29,196"
541,The War of the Worlds, Gene Barry, Ann Robinson, Les Tremayne, Robert Cornthwaite,Action, Sci-Fi, Thriller,4.36,G ,"37,110"
542,Taxi, Samy Naceri, Frédéric Diefenthal, Marion Cotillard, Manuela Gourary,Action, Comedy, Crime,0.27,Not Rated ,"86,123"
543,Dragon: The Bruce Lee Story, Jason Scott Lee, Lauren Holly, Robert Wagner, Michael Learned,Action, Biography, Drama,35.11,PG-13 ,"31,957"
544,Ip Man 3, Donnie Yen, Lynn Xiong, Jin Zhang, Mike Tyson,Action, Biography, Drama,2.68,PG-13 ,"57,742"
545,Don 2, Shah Rukh Khan, Florian Lukas, Om Puri, Priyanka Chopra Jonas,Action, Crime, Thriller,3.68,Not Rated ,"55,246"
546,The Protector, Tony Jaa, Nathan Jones, Xing Jin, Phetthai Vongkumlao,Action, Crime, Drama,11.91,R ,"38,133"
547,Curse of the Golden Flower, Chow Yun-Fat, Gong Li, Jay Chou, Ye Liu,Action, Drama, Romance,6.57,R ,"45,074"
548,Kabir Singh, Shahid Kapoor, Kiara Advani, Nikita Dutta, Soham Majumdar,Action, Drama, Romance,Nan,Not Rated ,"35,754"
549,Sultan, Salman Khan, Anushka Sharma, Randeep Hooda, Amit Sadh,Action, Drama, Romance,6.20,Not Rated ,"48,872"
550,Vikrant Rona, Sudeep, Nirup Bhandari, Neetha Ashok, Jacqueline Fernandez,Action, Crime, Drama,Nan,Not Rated ,"27,918"
551,Main Hoon Na, Shah Rukh Khan, Sushmita Sen, Suniel Shetty, Zayed Khan,Action, Comedy, Drama,1.72,Not Rated ,"37,717"
552,The Warlords, Jet Li, Andy Lau, Takeshi Kaneshiro, Jinglei Xu,Action, Adventure, Drama,0.13,R ,"27,357"
553,The Legend Is Born: Ip Man, Yu-Hang To, Yi Huang, Biao Yuen, Siu-Wong Fan,Action, Biography, Drama,Nan,Not Rated ,"32,519"
554,The Legend, Saravanan Arul, Geethika, Mayilsamy, Nassar,Action, Drama, Romance,Nan,UA ,"29,196"
555,Top Gun, Tom Cruise, Tim Robbins, Kelly McGillis, Val Kilmer,Action, Drama,Nan,179.80,PG ,"473,820"
556,Conan the Barbarian, Arnold Schwarzenegger, James Earl Jones, Max von Sydow, Sandahl Bergman,Action, Adventure, Fantasy,39.57,R ,"155,173"
557,Doctor Strange in the Multiverse of Madness, Benedict Cumberbatch, Elizabeth Olsen, Chiwetel Ejiofor, Benedict Wong,Action, Adventure, Fantasy,411.33,PG-13 ,"437,899"
558,Game Night, Jason Bateman, Rachel McAdams, Kyle Chandler, Sharon Horgan,Action, Adventure, Comedy,69.18,R ,"244,107"
559,A Knight's Tale, Heath Ledger, Mark Addy, Rufus Sewell, Shannyn Sossamon,Action, Adventure, Romance,56.57,PG-13 ,"193,255"
560,Jumanji: Welcome to the Jungle, Dwayne Johnson, Karen Gillan, Kevin Hart, Jack Black,Action, Adventure, Comedy,404.52,PG-13 ,"396,301"
561,Captain America: The First Avenger, Chris Evans, Hugo Weaving, Samuel L. Jackson, Hayley Atwell,Action, Adventure, Sci-Fi,176.65,PG-13 ,"863,772"
562,The Mask, Jim Carrey, Cameron Diaz, Peter Riegert, Peter Greene,Action, Comedy, Crime,119.94,PG-13 ,"398,644"
563,Mission: Impossible III, Tom Cruise, Michelle Monaghan, Ving Rhames, Philip Seymour Hoffman,Action, Adventure, Thriller,134.03,PG-13 ,"366,102"
564,Solo: A Star Wars Story, Alden Ehrenreich, Woody Harrelson, Emilia Clarke, Donald Glover,Action, Adventure, Sci-Fi,213.77,PG-13 ,"360,272"
565,Star Wars: Episode VIII - The Last Jedi, Daisy Ridley, John Boyega, Mark Hamill, Carrie Fisher,Action, Adventure, Fantasy,620.18,PG-13 ,"647,162"
566,The Amazing Spider-Man, Andrew Garfield, Emma Stone, Rhys Ifans, Irrfan Khan,Action, Adventure, Sci-Fi,262.03,PG-13 ,"671,660"
567,Pacific Rim, Idris Elba, Charlie Hunnam, Rinko Kikuchi, Charlie Day,Action, Adventure, Sci-Fi,101.80,PG-13 ,"512,771"
568,Jurassic World, Chris Pratt, Bryce Dallas Howard, Ty Simpkins, Judy Greer,Action, Adventure, Sci-Fi,652.27,PG-13 ,"656,397"
569,X-Men: Apocalypse, James McAvoy, Michael Fassbender, Jennifer Lawrence, Nicholas Hoult,Action, Adventure, Sci-Fi,155.44,PG-13 ,"445,454"
570,Iron Man 2, Robert Downey Jr., Mickey Rourke, Gwyneth Paltrow, Don Cheadle,Action, Sci-Fi,Nan,312.43,PG-13 ,"836,028"
571,National Treasure, Nicolas Cage, Diane Kruger, Justin Bartha, Sean Bean,Action, Adventure, Mystery,173.01,PG ,"342,632"
572,Con Air, Nicolas Cage, John Cusack, John Malkovich, Colm Meaney,Action, Crime, Thriller,101.12,R ,"307,848"
573,The World's End, Simon Pegg, Nick Frost, Martin Freeman, Rosamund Pike,Action, Comedy, Sci-Fi,26.00,R ,"288,754"
574,Romancing the Stone, Michael Douglas, Kathleen Turner, Danny DeVito, Zack Norman,Action, Adventure, Comedy,76.57,PG ,"98,473"
575,The Guardian, Kevin Costner, Ashton Kutcher, Sela Ward, Melissa Sagemiller,Action, Adventure, Drama,55.01,PG-13 ,"95,282"
576,Atlantis: The Lost Empire, Michael J. Fox, Jim Varney, Corey Burton, Claudia Christian,Animation, Action, Adventure,84.05,PG ,"126,017"
577,28 Weeks Later, Jeremy Renner, Rose Byrne, Robert Carlyle, Harold Perrineau,Action, Adventure, Horror,28.64,R ,"283,345"
578,Robin Hood: Prince of Thieves, Kevin Costner, Morgan Freeman, Mary Elizabeth Mastrantonio, Christian Slater,Action, Adventure, Drama,165.50,PG-13 ,"200,399"
579,Love and Monsters, Dylan O'Brien, Jessica Henwick, Michael Rooker, Dan Ewing,Action, Adventure, Comedy,1.07,PG-13 ,"134,143"
580,Dragged Across Concrete, Mel Gibson, Vince Vaughn, Tory Kittles, Michael Jai White,Action, Crime, Drama,Nan,R ,"50,916"
581,Pineapple Express, Seth Rogen, James Franco, Gary Cole, Danny McBride,Action, Comedy, Crime,87.34,R ,"347,568"
582,Thunderball, Sean Connery, Claudine Auger, Adolfo Celi, Luciana Paluzzi,Action, Adventure, Thriller,63.60,PG ,"122,331"
583,Outlaw King, Chris Pine, Stephen Dillane, Rebecca Robin, Billy Howle,Action, Biography, Drama,Nan,R ,"76,030"
584,Crank, Jason Statham, Amy Smart, Carlos Sanz, Jose Pablo Cantillo,Action, Crime, Thriller,27.83,R ,"255,469"
585,In the Heart of the Sea, Chris Hemsworth, Cillian Murphy, Brendan Gleeson, Ben Whishaw,Action, Adventure, Biography,25.02,PG-13 ,"143,032"
586,The Hitman's Bodyguard, Ryan Reynolds, Samuel L. Jackson, Gary Oldman, Elodie Yung,Action, Comedy, Crime,75.47,R ,"237,987"
587,Clear and Present Danger, Harrison Ford, Willem Dafoe, Anne Archer, Joaquim de Almeida,Action, Crime, Drama,122.19,PG-13 ,"103,469"
588,48 Hrs, Nick Nolte, Eddie Murphy, Annette O'Toole, Frank McRae,Action, Comedy, Crime,78.87,R ,"81,360"
589,Clash of the Titans, Laurence Olivier, Harry Hamlin, Claire Bloom, Maggie Smith,Action, Adventure, Family,41.09,PG ,"45,944"
590,Death Wish, Charles Bronson, Hope Lange, Vincent Gardenia, Steven Keats,Action, Crime, Drama,22.00,R ,"41,231"
591,The Edge, Anthony Hopkins, Alec Baldwin, Elle Macpherson, Harold Perrineau,Action, Adventure, Drama,27.78,R ,"76,111"
592,Non-Stop, Liam Neeson, Julianne Moore, Scoot McNairy, Michelle Dockery,Action, Mystery, Thriller,92.17,PG-13 ,"269,463"
593,The Last Castle, Robert Redford, James Gandolfini, Mark Ruffalo, Steve Burton,Action, Drama, Thriller,18.21,R ,"82,795"
594,The Monster Squad, Andre Gower, Robby Kiger, Stephen Macht, Duncan Regehr,Action, Comedy, Fantasy,3.77,PG-13 ,"33,640"
595,Repo Man, Harry Dean Stanton, Emilio Estevez, Tracey Walter, Olivia Barash,Action, Comedy, Crime,3.57,R ,"39,010"
596,Westworld, Yul Brynner, Richard Benjamin, James Brolin, Norman Bartold,Action, Sci-Fi, Thriller,16.06,PG ,"60,608"
597,The Night Comes for Us, Iko Uwais, Joe Taslim, Julie Estelle, Hannah Al Rashid,Action, Crime, Thriller,Nan,TV-MA ,"27,653"
598,Free State of Jones, Matthew McConaughey, Gugu Mbatha-Raw, Mahershala Ali, Keri Russell,Action, Biography, Drama,20.76,R ,"59,666"
599,Legend of the Guardians: The Owls of Ga'Hoole, Jim Sturgess, Hugo Weaving, David Wenham, Emily Barclay,Animation, Action, Adventure,55.68,PG ,"85,196"
600,Memphis Belle, Matthew Modine, Eric Stoltz, Tate Donovan, D.B. Sweeney,Action, Drama, War,27.44,PG-13 ,"29,395"
601,Muppet Treasure Island, Tim Curry, Billy Connolly, Jennifer Saunders, Kevin Bishop,Action, Adventure, Comedy,33.61,G ,"25,257"
602,Slow West, Kodi Smit-McPhee, Caren Pistorius, Aorere Paki, Jeffrey Thomas,Action, Adventure, Drama,0.23,R ,"46,600"
603,All Is Lost, Robert Redford,Nan,Nan,Nan,Action, Adventure, Drama,6.26,PG-13 ,"81,980"
604,Get the Gringo, Mel Gibson, Kevin Balmore, Daniel Giménez Cacho, Jesús Ochoa,Action, Drama, Thriller,Nan,R ,"109,731"
605,The Big Boss, Bruce Lee, Maria Yi, James Tien, Marilyn Bautista,Action, Crime, Drama,0.04,R ,"28,127"
606,New Police Story, Jackie Chan, Nicholas Tse, Charlie Yeung, Daniel Wu,Action, Crime, Thriller,Nan,R ,"28,025"
607,Agneepath, Hrithik Roshan, Priyanka Chopra Jonas, Sanjay Dutt, Rishi Kapoor,Action, Crime, Drama,1.98,Not Rated ,"25,505"
608,Traitor, Don Cheadle, Guy Pearce, Archie Panjabi, Saïd Taghmaoui,Action, Crime, Drama,23.53,PG-13 ,"58,437"
609,Fan, Shah Rukh Khan, Shriya Pilgaonkar, Sayani Gupta, Waluscha D'Souza,Action, Drama, Thriller,1.36,Not Rated ,"47,510"
610,Alan Partridge, Steve Coogan, Colm Meaney, Tim Key, Karl Theobald,Action, Comedy, Crime,0.15,R ,"32,442"
611,The Fast and the Furious, Vin Diesel, Paul Walker, Michelle Rodriguez, Jordana Brewster,Action, Crime, Thriller,144.53,PG-13 ,"397,698"
612,The Magnificent Seven, Denzel Washington, Chris Pratt, Ethan Hawke, Vincent D'Onofrio,Action, Adventure, Drama,93.43,PG-13 ,"218,906"
613,The Woman King, Viola Davis, Thuso Mbedu, Lashana Lynch, Sheila Atim,Action, Drama, History,67.33,PG-13 ,"60,592"
614,Ready or Not, Samara Weaving, Adam Brody, Mark O'Brien, Henry Czerny,Action, Comedy, Horror,28.71,R ,"163,321"
615,Captain Marvel, Brie Larson, Samuel L. Jackson, Ben Mendelsohn, Jude Law,Action, Adventure, Sci-Fi,426.83,PG-13 ,"578,488"
616,Aquaman, Jason Momoa, Amber Heard, Willem Dafoe, Patrick Wilson,Action, Adventure, Fantasy,335.06,PG-13 ,"490,522"
617,The Book of Eli, Denzel Washington, Mila Kunis, Ray Stevenson, Gary Oldman,Action, Adventure, Drama,94.84,R ,"326,748"
618,The Maze Runner, Dylan O'Brien, Kaya Scodelario, Will Poulter, Thomas Brodie-Sangster,Action, Mystery, Sci-Fi,102.43,PG-13 ,"483,081"
619,Kisi Ka Bhai Kisi Ki Jaan, Salman Khan, Pooja Hegde, Venkatesh Daggubati, Aamir Naik,Action, Comedy, Drama,Nan,Not Rated ,"35,936"
