,MovieName,Star1,Star2,Star3,Star4,Genre1,Genre2,Genre3,Gross_Collection,Certification,votes
0,The Dark Knight, Christian Bale, Heath Ledger, Aaron Eckhart, Michael Caine,Action, Crime, Drama,534.86,PG-13 ,"2,714,822"
1,The Lord of the Rings: The Return of the King, Elijah Wood, Viggo Mortensen, Ian McKellen, Orlando Bloom,Action, Adventure, Drama,377.85,PG-13 ,"1,885,048"
2,Inception, Leonardo DiCaprio, Joseph Gordon-Levitt, Elliot Page, Ken Watanabe,Action, Adventure, Sci-Fi,292.58,PG-13 ,"2,409,922"
3,The Lord of the Rings: The Fellowship of the Ring, Elijah Wood, Ian McKellen, Orlando Bloom, Sean Bean,Action, Adventure, Drama,315.54,PG-13 ,"1,913,811"
4,The Lord of the Rings: The Two Towers, Elijah Wood, Ian McKellen, Viggo Mortensen, Orlando Bloom,Action, Adventure, Drama,342.55,PG-13 ,"1,701,534"
5,The Matrix, Keanu Reeves, Laurence Fishburne, Carrie-Anne Moss, Hugo Weaving,Action, Sci-Fi,Nan,171.48,R ,"1,955,482"
6,Star Wars: Episode V - The Empire Strikes Back, Mark Hamill, Harrison Ford, Carrie Fisher, Billy Dee Williams,Action, Adventure, Fantasy,290.48,PG ,"1,319,614"
7,Soorarai Pottru, Suriya, Paresh Rawal, Aparna Balamurali, Urvashi,Action, Drama,Nan,Nan,TV-MA ,"119,393"
8,Star Wars: Episode IV - A New Hope, Mark Hamill, Harrison Ford, Carrie Fisher, Alec Guinness,Action, Adventure, Fantasy,322.74,PG ,"1,392,136"
9,Terminator 2: Judgment Day, Arnold Schwarzenegger, Linda Hamilton, Edward Furlong, Robert Patrick,Action, Sci-Fi,Nan,204.84,R ,"1,121,854"
10,Seven Samurai, Toshirô Mifune, Takashi Shimura, Keiko Tsushima, Yukiko Shimazaki,Action, Drama,Nan,0.27,Not Rated ,"352,495"
11,Harakiri, Tatsuya Nakadai, Akira Ishihama, Shima Iwashita, Tetsurô Tanba,Action, Drama, Mystery,Nan,Not Rated ,"60,827"
12,Sita Ramam, Dulquer Salmaan, Mrunal Thakur, Rashmika Mandanna, Sumanth,Action, Drama, Mystery,Nan,U ,"59,608"
13,Léon: The Professional, Jean Reno, Gary Oldman, Natalie Portman, Danny Aiello,Action, Crime, Drama,19.50,R ,"1,187,952"
14,Gladiator, Russell Crowe, Joaquin Phoenix, Connie Nielsen, Oliver Reed,Action, Adventure, Drama,187.71,R ,"1,534,484"
15,Avengers: Endgame, Robert Downey Jr., Chris Evans, Mark Ruffalo, Chris Hemsworth,Action, Adventure, Drama,858.37,PG-13 ,"1,177,505"
16,Spider-Man: Into the Spider-Verse, Shameik Moore, Jake Johnson, Hailee Steinfeld, Mahershala Ali,Animation, Action, Adventure,190.24,PG ,"562,301"
17,Indiana Jones and the Raiders of the Lost Ark, Harrison Ford, Karen Allen, Paul Freeman, John Rhys-Davies,Action, Adventure,Nan,248.16,PG ,"985,174"
18,Avengers: Infinity War, Robert Downey Jr., Chris Hemsworth, Mark Ruffalo, Chris Evans,Action, Adventure, Sci-Fi,678.82,PG-13 ,"1,121,032"
19,Oldboy, Choi Min-sik, Yoo Ji-tae, Kang Hye-jeong, Kim Byeong-Ok,Action, Drama, Mystery,0.71,R ,"595,512"
20,The Dark Knight Rises, Christian Bale, Tom Hardy, Anne Hathaway, Gary Oldman,Action, Drama, Thriller,448.14,PG-13 ,"1,739,683"
21,Aliens, Sigourney Weaver, Michael Biehn, Carrie Henn, Paul Reiser,Action, Adventure, Sci-Fi,85.16,R ,"731,852"
22,Kaithi, Karthi, Narain, Arjun Das, George Maryan,Action, Adventure, Crime,Nan,Not Rated ,"35,982"
23,Asuran, Dhanush, Manju Warrier, Prakash Raj, Pasupathy,Action, Drama,Nan,Nan,Not Rated ,"31,142"
24,Guardians of the Galaxy Vol, Chris Pratt, Chukwudi Iwuji, Bradley Cooper, Pom Klementieff,Action, Adventure, Comedy,Nan,PG-13 ,"129,836"
25,Heat, Al Pacino, Robert De Niro, Val Kilmer, Jon Voight,Action, Crime, Drama,67.44,R ,"674,446"
26,Top Gun: Maverick, Tom Cruise, Jennifer Connelly, Miles Teller, Val Kilmer,Action, Drama,Nan,718.73,PG-13 ,"585,871"
27,Star Wars: Episode VI - Return of the Jedi, Mark Hamill, Harrison Ford, Carrie Fisher, Billy Dee Williams,Action, Adventure, Fantasy,309.13,PG ,"1,076,425"
28,Princess Mononoke, Yôji Matsuda, Yuriko Ishida, Yûko Tanaka, Billy Crudup,Animation, Action, Adventure,2.38,PG-13 ,"406,168"
29,North by Northwest, Cary Grant, Eva Marie Saint, James Mason, Jessie Royce Landis,Action, Adventure, Mystery,13.28,Approved ,"334,311"
30,Kantara, Rishab Shetty, Kishore Kumar G., Achyuth Kumar, Sapthami Gowda,Action, Adventure, Drama,Nan,Not Rated ,"95,131"
31,Dangal, Aamir Khan, Sakshi Tanwar, Fatima Sana Shaikh, Sanya Malhotra,Action, Biography, Drama,12.39,Not Rated ,"197,061"
32,K, Yash, Sanjay Dutt, Raveena Tandon, Srinidhi Shetty,Action, Crime, Drama,6.60,Not Rated ,"139,422"
33,Vikram, Kamal Haasan, Vijay Sethupathi, Fahadh Faasil, Narain,Action, Crime, Thriller,Nan,UA ,"63,700"
34,Raatchasan, Vishnu Vishal, Amala Paul, Radha Ravi, Sangili Murugan,Action, Crime, Drama,Nan,Not Rated ,"46,874"
35,Shershaah, Sidharth Malhotra, Kiara Advani, Shiv Panditt, Pranay Pachauri,Action, Biography, Drama,Nan,TV-14 ,"124,634"
36,John Wick: Chapter 4, Keanu Reeves, Laurence Fishburne, George Georgiou, Lance Reddick,Action, Crime, Thriller,Nan,R ,"151,529"
37,Spider-Man: No Way Home, Tom Holland, Zendaya, Benedict Cumberbatch, Jacob Batalon,Action, Adventure, Fantasy,804.75,PG-13 ,"794,657"
38,Jurassic Park, Sam Neill, Laura Dern, Jeff Goldblum, Richard Attenborough,Action, Adventure, Sci-Fi,402.45,PG-13 ,"1,012,779"
39,1917, Dean-Charles Chapman, George MacKay, Daniel Mays, Colin Firth,Action, Drama, War,159.23,R ,"619,630"
40,Kill Bill: Vol, Uma Thurman, David Carradine, Daryl Hannah, Michael Madsen,Action, Crime, Drama,70.10,R ,"1,139,640"
41,Indiana Jones and the Last Crusade, Harrison Ford, Sean Connery, Alison Doody, Denholm Elliott,Action, Adventure,Nan,197.17,PG-13 ,"770,312"
42,Batman Begins, Christian Bale, Michael Caine, Ken Watanabe, Liam Neeson,Action, Crime, Drama,206.85,PG-13 ,"1,501,607"
43,Die Hard, Bruce Willis, Alan Rickman, Bonnie Bedelia, Reginald VelJohnson,Action, Thriller,Nan,83.01,R ,"900,594"
44,V for Vendetta, Hugo Weaving, Natalie Portman, Rupert Graves, Stephen Rea,Action, Drama, Sci-Fi,70.51,R ,"1,139,944"
45,Warrior, Tom Hardy, Nick Nolte, Joel Edgerton, Jennifer Morrison,Action, Drama, Sport,13.66,PG-13 ,"481,457"
46,Demon Slayer the Movie: Mugen Train, Natsuki Hanae, Akari Kitô, Yoshitsugu Matsuoka, Hiro Shimono,Animation, Action, Adventure,47.70,R ,"64,058"
47,Vikram Vedha, Madhavan, Vijay Sethupathi, Shraddha Srinath, Kathir,Action, Crime, Drama,Nan,Not Rated ,"47,525"
48,Ran, Tatsuya Nakadai, Akira Terao, Jinpachi Nezu, Daisuke Ryû,Action, Drama, War,4.14,R ,"128,989"
49,Baahubali 2: The Conclusion, Prabhas, Rana Daggubati, Anushka Shetty, Tamannaah Bhatia,Action, Drama,Nan,20.19,Not Rated ,"106,539"
50,Yojimbo, Toshirô Mifune, Eijirô Tôno, Tatsuya Nakadai, Yôko Tsukasa,Action, Drama, Thriller,Nan,Not Rated ,"125,762"
51,Sherlock Jr, Buster Keaton, Kathryn McGuire, Joe Keaton, Erwin Connelly,Action, Comedy, Romance,0.98,Passed ,"52,355"
52,Gangs of Wasseypur, Manoj Bajpayee, Nawazuddin Siddiqui, Tigmanshu Dhulia, Richa Chadha,Action, Comedy, Crime,Nan,Not Rated ,"99,245"
53,Rangasthalam 1985, Ram Charan, Samantha Ruth Prabhu, Aadhi, Jagapathi Babu,Action, Drama,Nan,3.51,Not Rated ,"26,120"
54,K, Yash, Srinidhi Shetty, Ramachandra Raju, Archana Jois,Action, Crime, Drama,Nan,Not Rated ,"91,421"
55,Uri: The Surgical Strike, Vicky Kaushal, Paresh Rawal, Mohit Raina, Yami Gautam,Action, Drama, History,4.19,Not Rated ,"67,049"
56,The Mountain II, Caglar Ertugrul, Ufuk Bayraktar, Ahu Türkpençe, Murat Serezli,Action, Drama, War,Nan,Nan,"109,152"
57,Paan Singh Tomar, Irrfan Khan, Mahie Gill, Rajesh Abhay, Hemendra Dandotiya,Action, Biography, Crime,0.04,Not Rated ,"37,023"
58,Mad Max: Fury Road, Tom Hardy, Charlize Theron, Nicholas Hoult, Zoë Kravitz,Action, Adventure, Sci-Fi,154.06,R ,"1,028,816"
59,Ford v Ferrari, Matt Damon, Christian Bale, Jon Bernthal, Caitríona Balfe,Action, Biography, Drama,117.62,PG-13 ,"417,337"
60,Pirates of the Caribbean: The Curse of the Black Pearl, Johnny Depp, Geoffrey Rush, Orlando Bloom, Keira Knightley,Action, Adventure, Fantasy,305.41,PG-13 ,"1,152,340"
61,Blade Runner, Harrison Ford, Rutger Hauer, Sean Young, Edward James Olmos,Action, Drama, Sci-Fi,32.87,R ,"787,120"
62,The Terminator, Arnold Schwarzenegger, Linda Hamilton, Michael Biehn, Paul Winfield,Action, Sci-Fi,Nan,38.40,R ,"884,472"
63,Logan, Hugh Jackman, Patrick Stewart, Dafne Keen, Boyd Holbrook,Action, Drama, Sci-Fi,226.28,R ,"786,356"
64,"Lock, Stock and Two Smoking Barrels", Jason Flemyng, Dexter Fletcher, Nick Moran, Jason Statham,Action, Comedy, Crime,3.90,R ,"594,662"
65,How to Train Your Dragon, Jay Baruchel, Gerard Butler, Christopher Mintz-Plasse, Craig Ferguson,Animation, Action, Adventure,217.58,PG ,"760,258"
66,Rush, Daniel Brühl, Chris Hemsworth, Olivia Wilde, Alexandra Maria Lara,Action, Biography, Drama,26.95,R ,"490,635"
67,The Iron Giant, Eli Marienthal, Harry Connick Jr., Jennifer Aniston, Vin Diesel,Animation, Action, Adventure,23.16,PG ,"208,615"
68,Neon Genesis Evangelion: The End of Evangelion, Megumi Ogata, Megumi Hayashibara, Yûko Miyamura, Kotono Mitsuishi,Animation, Action, Drama,Nan,TV-MA ,"58,422"
69,The Hidden Fortress, Toshirô Mifune, Misa Uehara, Minoru Chiaki, Kamatari Fujiwara,Action, Adventure, Drama,Nan,Not Rated ,"40,415"
70,The General, Buster Keaton, Marion Mack, Glen Cavender, Jim Farley,Action, Adventure, Comedy,1.03,Passed ,"93,776"
71,White Heat, James Cagney, Virginia Mayo, Edmond O'Brien, Margaret Wycherly,Action, Crime, Drama,Nan,Not Rated ,"34,248"
72,A Wednesday, Anupam Kher, Naseeruddin Shah, Veerendra Saxena, Mahesh Kanual,Action, Crime, Drama,Nan,Not Rated ,"80,167"
73,Bajrangi Bhaijaan, Salman Khan, Harshaali Malhotra, Nawazuddin Siddiqui, Kareena Kapoor,Action, Adventure, Comedy,8.18,Not Rated ,"91,811"
74,Sholay, Sanjeev Kumar, Dharmendra, Amitabh Bachchan, Amjad Khan,Action, Adventure, Comedy,Nan,Not Rated ,"57,032"
75,Major, Adivi Sesh, Prakash Raj, Revathi, Saiee Manjrekar,Action, Biography, Drama,Nan,UA ,"30,403"
76,Hera Pheri, Akshay Kumar, Suniel Shetty, Paresh Rawal, Tabu,Action, Comedy, Crime,Nan,Not Rated ,"69,358"
77,Thuppakki, Joseph Vijay, Kajal Aggarwal, Vidyut Jammwal, Sathyan,Action, Thriller,Nan,Nan,Not Rated ,"35,891"
78,Sarfarosh, Aamir Khan, Naseeruddin Shah, Sonali Bendre, Mukesh Rishi,Action, Drama, Thriller,Nan,Not Rated ,"26,211"
79,Kaththi, Joseph Vijay, Samantha Ruth Prabhu, Neil Nitin Mukesh, Tota Roy Chowdhury,Action, Drama,Nan,Nan,Not Rated ,"28,304"
80,Guardians of the Galaxy, Chris Pratt, Vin Diesel, Bradley Cooper, Zoe Saldana,Action, Adventure, Comedy,333.18,PG-13 ,"1,213,974"
81,Dune, Timothée Chalamet, Rebecca Ferguson, Zendaya, Oscar Isaac,Action, Adventure, Drama,108.33,PG-13 ,"675,258"
82,Blade Runner 2049, Harrison Ford, Ryan Gosling, Ana de Armas, Dave Bautista,Action, Drama, Mystery,92.05,R ,"602,509"
83,Deadpool, Ryan Reynolds, Morena Baccarin, T.J. Miller, Ed Skrein,Action, Comedy,Nan,363.07,R ,"1,066,340"
84,The Avengers, Robert Downey Jr., Chris Evans, Scarlett Johansson, Jeremy Renner,Action, Sci-Fi,Nan,623.28,PG-13 ,"1,414,692"
85,Zack Snyder's Justice League, Henry Cavill, Ben Affleck, Gal Gadot, Amy Adams,Action, Adventure, Fantasy,Nan,R ,"412,035"
86,Casino Royale, Daniel Craig, Eva Green, Judi Dench, Jeffrey Wright,Action, Adventure, Thriller,167.45,PG-13 ,"670,430"
87,The Incredibles, Craig T. Nelson, Samuel L. Jackson, Holly Hunter, Jason Lee,Animation, Action, Adventure,261.44,PG ,"760,266"
88,The Revenant, Leonardo DiCaprio, Tom Hardy, Will Poulter, Domhnall Gleeson,Action, Adventure, Drama,183.64,R ,"826,937"
89,Akira, Mitsuo Iwata, Nozomu Sasaki, Mami Koyama, Tesshô Genda,Animation, Action, Drama,0.55,R ,"193,337"
90,Kill Bill: Vol, Uma Thurman, David Carradine, Michael Madsen, Daryl Hannah,Action, Crime, Thriller,66.21,R ,"773,323"
91,Ip Man, Donnie Yen, Simon Yam, Siu-Wong Fan, Ka-Tung Lam,Action, Biography, Drama,Nan,R ,"228,205"
92,The Bourne Ultimatum, Matt Damon, Edgar Ramírez, Joan Allen, Julia Stiles,Action, Mystery, Thriller,227.47,PG-13 ,"643,733"
93,Wolfwalkers, Honor Kneafsey, Eva Whittaker, Sean Bean, Simon McBurney,Animation, Action, Adventure,Nan,PG ,"35,053"
94,Infernal Affairs, Andy Lau, Tony Leung Chiu-wai, Anthony Chau-Sang Wong, Eric Tsang,Action, Crime, Drama,0.17,R ,"127,543"
95,Baahubali: The Beginning, Prabhas, Rana Daggubati, Anushka Shetty, Tamannaah Bhatia,Action, Drama,Nan,6.74,Not Rated ,"129,800"
96,Elite Squad, Wagner Moura, André Ramiro, Caio Junqueira, Milhem Cortaz,Action, Crime, Drama,0.01,R ,"106,655"
97,Haider, Shahid Kapoor, Tabu, Shraddha Kapoor, Kay Kay Menon,Action, Crime, Drama,0.90,Not Rated ,"56,046"
98,Elite Squad 2: The Enemy Within, Wagner Moura, Irandhir Santos, André Ramiro, Milhem Cortaz,Action, Crime, Drama,0.10,Not Rated ,"84,690"
99,Sanjuro, Toshirô Mifune, Tatsuya Nakadai, Keiju Kobayashi, Yûnosuke Itô,Action, Drama, Thriller,Nan,Not Rated ,"39,405"
100,Andaz Apna Apna, Aamir Khan, Salman Khan, Raveena Tandon, Karisma Kapoor,Action, Comedy, Romance,Nan,Not Rated ,"54,182"
101,Tae Guk Gi: The Brotherhood of War, Jang Dong-Gun, Won Bin, Eun-ju Lee, Hyeong-jin Kong,Action, Drama, War,1.11,R ,"40,351"
102,Karthikeya 2, Nikhil Siddharth, Anupama Parameswaran, Srinivasa Reddy, Harsha Chemudu,Action, Adventure, Fantasy,Nan,UA ,"63,147"
103,The Breath, Mete Horozoglu, Ilker Kizmaz, Baris Bagci, Özgür Eren Koç,Action, Drama, Thriller,Nan,Nan,"34,370"
104,Arjun Reddy, Vijay Deverakonda, Shalini Pandey, Jia Sharma, Kanchana,Action, Drama, Romance,Nan,Not Rated ,"26,270"
105,1: Nenokkadine, Mahesh Babu, Kriti Sanon, Nassar, Pradeep Singh Rawat,Action, Thriller,Nan,Nan,Not Rated ,"45,876"
106,Avatar, Sam Worthington, Zoe Saldana, Sigourney Weaver, Michelle Rodriguez,Action, Adventure, Fantasy,760.51,PG-13 ,"1,341,228"
107,Iron Man, Robert Downey Jr., Gwyneth Paltrow, Terrence Howard, Jeff Bridges,Action, Adventure, Sci-Fi,318.41,PG-13 ,"1,081,256"
108,Star Trek, Chris Pine, Zachary Quinto, Simon Pegg, Leonard Nimoy,Action, Adventure, Sci-Fi,257.73,PG-13 ,"610,081"
109,Thor: Ragnarok, Chris Hemsworth, Tom Hiddleston, Cate Blanchett, Mark Ruffalo,Action, Adventure, Comedy,315.06,PG-13 ,"774,813"
110,Edge of Tomorrow, Tom Cruise, Emily Blunt, Bill Paxton, Brendan Gleeson,Action, Adventure, Sci-Fi,100.21,PG-13 ,"698,437"
111,Children of Men, Julianne Moore, Clive Owen, Chiwetel Ejiofor, Michael Caine,Action, Drama, Sci-Fi,35.55,R ,"511,283"
112,X-Men: Days of Future Past, Patrick Stewart, Ian McKellen, Hugh Jackman, James McAvoy,Action, Adventure, Sci-Fi,233.92,PG-13 ,"724,537"
113,The Bourne Identity, Franka Potente, Matt Damon, Chris Cooper, Clive Owen,Action, Mystery, Thriller,121.66,PG-13 ,"558,385"
114,District 9, Sharlto Copley, David James, Jason Cope, Nathalie Boltt,Action, Sci-Fi, Thriller,115.65,R ,"694,447"
115,The Blues Brothers, John Belushi, Dan Aykroyd, Cab Calloway, John Candy,Action, Adventure, Comedy,57.23,R ,"205,693"
116,The Adventures of Robin Hood, Errol Flynn, Olivia de Havilland, Basil Rathbone, Claude Rains,Action, Adventure, Romance,3.98,PG ,"52,775"
117,"Crouching Tiger, Hidden Dragon", Chow Yun-Fat, Michelle Yeoh, Ziyi Zhang, Chang Chen,Action, Adventure, Drama,128.08,PG-13 ,"275,495"
118,Ghost in the Shell, Atsuko Tanaka, Iemasa Kayumi, Akio Ôtsuka, Kôichi Yamadera,Animation, Action, Crime,0.52,TV-MA ,"148,246"
119,A Fistful of Dollars, Clint Eastwood, Gian Maria Volontè, Marianne Koch, Wolfgang Lukschy,Action, Drama, Western,14.50,R ,"223,216"
120,The Wild Bunch, William Holden, Ernest Borgnine, Robert Ryan, Edmond O'Brien,Action, Adventure, Drama,12.06,R ,"87,318"
121,The Raid 2, Iko Uwais, Yayan Ruhian, Arifin Putra, Oka Antara,Action, Crime, Thriller,2.63,R ,"126,961"
122,Hero, Jet Li, Tony Leung Chiu-wai, Maggie Cheung, Ziyi Zhang,Action, Adventure, Drama,53.71,PG-13 ,"184,344"
123,Letters from Iwo Jima, Ken Watanabe, Kazunari Ninomiya, Tsuyoshi Ihara, Ryo Kase,Action, Adventure, Drama,13.76,R ,"166,166"
124,A Taxi Driver, Song Kang-ho, Thomas Kretschmann, Hae-Jin Yoo, Ryu Jun-Yeol,Action, Drama, History,1.53,Not Rated ,"27,300"
125,Baby, Akshay Kumar, Danny Denzongpa, Rana Daggubati, Taapsee Pannu,Action, Crime, Thriller,Nan,Not Rated ,"58,780"
126,Airlift, Akshay Kumar, Nimrat Kaur, Kumud Mishra, Prakash Belawadi,Action, Drama, History,Nan,Not Rated ,"57,824"
127,Vishwaroopam, Pooja Kumar, Miles Anderson, Kamal Haasan, Rahul Bose,Action, Thriller,Nan,Nan,Not Rated ,"40,544"
128,Everything Everywhere All at Once, Michelle Yeoh, Stephanie Hsu, Jamie Lee Curtis, Ke Huy Quan,Action, Adventure, Comedy,72.86,R ,"445,534"
129,The Batman, Robert Pattinson, Zoë Kravitz, Jeffrey Wright, Colin Farrell,Action, Crime, Drama,369.35,PG-13 ,"698,461"
130,All Quiet on the Western Front, Felix Kammerer, Albrecht Schuch, Aaron Hilmer, Moritz Klaus,Action, Drama, War,Nan,R ,"203,935"
131,The Gentlemen, Matthew McConaughey, Charlie Hunnam, Michelle Dockery, Jeremy Strong,Action, Comedy, Crime,36.47,R ,"359,858"
132,Rogue One: A Star Wars Story, Felicity Jones, Diego Luna, Alan Tudyk, Donnie Yen,Action, Adventure, Sci-Fi,532.18,PG-13 ,"657,056"
133,RRR, N.T. Rama Rao Jr., Ram Charan, Ajay Devgn, Alia Bhatt,Action, Drama,Nan,14.50,Not Rated ,"149,722"
134,Drive, Ryan Gosling, Carey Mulligan, Bryan Cranston, Albert Brooks,Action, Drama,Nan,35.06,R ,"663,479"
135,Ghostbusters, Bill Murray, Dan Aykroyd, Sigourney Weaver, Harold Ramis,Action, Comedy, Fantasy,238.63,PG ,"425,349"
136,Apocalypto, Gerardo Taracena, Raoul Max Trujillo, Dalia Hernández, Rudy Youngblood,Action, Adventure, Drama,50.87,R ,"319,884"
137,Dunkirk, Fionn Whitehead, Barry Keoghan, Mark Rylance, Tom Hardy,Action, Drama, History,188.37,PG-13 ,"681,360"
138,Star Wars: Episode VII - The Force Awakens, Daisy Ridley, John Boyega, Oscar Isaac, Domhnall Gleeson,Action, Adventure, Sci-Fi,936.66,PG-13 ,"946,650"
139,Predator, Arnold Schwarzenegger, Carl Weathers, Kevin Peter Hall, Elpidia Carrillo,Action, Adventure, Horror,59.74,R ,"434,010"
140,Taken, Liam Neeson, Maggie Grace, Famke Janssen, Leland Orser,Action, Crime, Thriller,145.00,PG-13 ,"614,230"
141,Captain America: Civil War, Chris Evans, Robert Downey Jr., Scarlett Johansson, Sebastian Stan,Action, Sci-Fi,Nan,408.08,PG-13 ,"810,541"
142,Skyfall, Daniel Craig, Javier Bardem, Naomie Harris, Judi Dench,Action, Adventure, Thriller,304.36,PG-13 ,"709,248"
143,Hot Fuzz, Simon Pegg, Nick Frost, Martin Freeman, Bill Nighy,Action, Comedy, Mystery,23.64,R ,"516,747"
144,Captain America: The Winter Soldier, Chris Evans, Samuel L. Jackson, Scarlett Johansson, Robert Redford,Action, Adventure, Sci-Fi,259.77,PG-13 ,"865,695"
145,Serenity, Nathan Fillion, Gina Torres, Chiwetel Ejiofor, Alan Tudyk,Action, Adventure, Sci-Fi,25.51,PG-13 ,"300,169"
146,The Last Samurai, Tom Cruise, Ken Watanabe, Billy Connolly, William Atherton,Action, Drama,Nan,111.11,R ,"451,729"
147,I Saw the Devil, Lee Byung-hun, Choi Min-sik, Jeon Gook-hwan, Ho-jin Chun,Action, Crime, Drama,0.13,Not Rated ,"136,899"
148,Captain Phillips, Tom Hanks, Barkhad Abdi, Barkhad Abdirahman, Catherine Keener,Action, Biography, Crime,107.10,PG-13 ,"472,774"
149,Big Hero 6, Ryan Potter, Scott Adsit, Jamie Chung, T.J. Miller,Animation, Action, Adventure,222.53,PG ,"475,906"
150,The Fugitive, Harrison Ford, Tommy Lee Jones, Sela Ward, Julianne Moore,Action, Crime, Drama,183.88,PG-13 ,"304,340"
151,Thirteen Lives, Viggo Mortensen, Colin Farrell, Joel Edgerton, Tom Bateman,Action, Adventure, Biography,Nan,PG-13 ,"60,441"
152,The Fighter, Mark Wahlberg, Christian Bale, Amy Adams, Melissa Leo,Action, Biography, Drama,93.62,R ,"376,680"
153,How to Train Your Dragon 2, Jay Baruchel, Cate Blanchett, Gerard Butler, Craig Ferguson,Animation, Action, Adventure,177.00,PG ,"347,130"
154,The Chaser, Kim Yoon-seok, Ha Jung-woo, Yeong-hie Seo, Kim Yoo-jeong,Action, Crime, Drama,Nan,Not Rated ,"69,108"
155,Ninja Scroll, Kôichi Yamadera, Emi Shinohara, Takeshi Aono, Osamu Saka,Animation, Action, Adventure,Nan,Not Rated ,"38,811"
156,"Aguirre, the Wrath of God", Klaus Kinski, Ruy Guerra, Helena Rojo, Del Negro,Action, Adventure, Biography,Nan,Not Rated ,"59,060"
157,Batman: Mask of the Phantasm, Kevin Conroy, Dana Delany, Hart Bochner, Stacy Keach,Animation, Action, Adventure,5.62,PG ,"53,438"
158,Cowboy Bebop: The Movie, Beau Billingslea, Melissa Fahn, Nicholas Guest, Kôichi Yamadera,Animation, Action, Crime,1.00,TV-14 ,"50,609"
159,Minnal Murali, Tovino Thomas, Guru Somasundaram, Aju Varghese, Baiju,Action, Comedy, Drama,Nan,TV-14 ,"31,026"
160,The Killer, Chow Yun-Fat, Danny Lee, Sally Yeh, Kong Chu,Action, Crime, Drama,Nan,R ,"49,548"
161,Knockin' on Heaven's Door, Til Schweiger, Jan Josef Liefers, Thierry van Werveke, Moritz Bleibtreu,Action, Crime, Comedy,0.00,Not Rated ,"32,051"
162,Avatar: The Way of Water, Sam Worthington, Zoe Saldana, Sigourney Weaver, Stephen Lang,Action, Adventure, Fantasy,659.68,PG-13 ,"381,462"
163,Kingsman: The Secret Service, Colin Firth, Taron Egerton, Samuel L. Jackson, Michael Caine,Action, Adventure, Comedy,128.26,R ,"685,482"
164,Black Hawk Down, Josh Hartnett, Ewan McGregor, Tom Sizemore, Eric Bana,Action, Drama, History,108.64,R ,"406,725"
165,Mission: Impossible - Fallout, Tom Cruise, Henry Cavill, Ving Rhames, Simon Pegg,Action, Adventure, Thriller,220.16,PG-13 ,"344,423"
166,3:10 to Yuma, Russell Crowe, Christian Bale, Ben Foster, Logan Lerman,Action, Crime, Drama,53.61,R ,"319,986"
167,The Count of Monte Cristo, Jim Caviezel, Guy Pearce, Christopher Adamson, JB Blanc,Action, Adventure, Drama,54.23,PG-13 ,"142,465"
168,The Dirty Dozen, Lee Marvin, Ernest Borgnine, Charles Bronson, John Cassavetes,Action, Adventure, War,45.30,Approved ,"75,997"
169,The Last of the Mohicans, Daniel Day-Lewis, Madeleine Stowe, Russell Means, Eric Schweig,Action, Adventure, Drama,75.51,R ,"177,338"
170,Goldfinger, Sean Connery, Gert Fröbe, Honor Blackman, Shirley Eaton,Action, Adventure, Thriller,51.08,PG ,"195,487"
171,Man on Fire, Denzel Washington, Christopher Walken, Dakota Fanning, Radha Mitchell,Action, Crime, Drama,77.91,R ,"371,720"
172,Training Day, Denzel Washington, Ethan Hawke, Scott Glenn, Tom Berenger,Action, Crime, Drama,76.63,R ,"449,748"
173,The Lego Movie, Chris Pratt, Will Ferrell, Elizabeth Banks, Will Arnett,Animation, Action, Adventure,257.76,PG ,"368,504"
174,X-Men: First Class, James McAvoy, Michael Fassbender, Jennifer Lawrence, Kevin Bacon,Action, Sci-Fi,Nan,146.41,PG-13 ,"704,352"
175,First Blood, Sylvester Stallone, Brian Dennehy, Richard Crenna, Bill McKinney,Action, Adventure, Thriller,47.21,R ,"262,016"
176,The Magnificent Seven, Yul Brynner, Steve McQueen, Charles Bronson, Eli Wallach,Action, Adventure, Drama,4.91,Approved ,"98,157"
177,Star Trek Into Darkness, Chris Pine, Zachary Quinto, Zoe Saldana, Benedict Cumberbatch,Action, Adventure, Sci-Fi,228.78,PG-13 ,"489,077"
178,The Boondock Saints, Willem Dafoe, Sean Patrick Flanery, Norman Reedus, David Della Rocco,Action, Thriller,Nan,0.03,R ,"243,301"
179,Kung Fu Hustle, Stephen Chow, Wah Yuen, Qiu Yuen, Siu-Lung Leung,Action, Comedy, Fantasy,17.11,R ,"144,301"
180,Dirty Harry, Clint Eastwood, Andrew Robinson, Harry Guardino, Reni Santoni,Action, Crime, Thriller,35.90,R ,"161,580"
181,Star Trek II: The Wrath of Khan, William Shatner, Leonard Nimoy, DeForest Kelley, James Doohan,Action, Adventure, Sci-Fi,78.91,PG ,"125,112"
182,The Bourne Supremacy, Matt Damon, Franka Potente, Joan Allen, Brian Cox,Action, Mystery, Thriller,176.24,PG-13 ,"473,185"
183,The Longest Day, John Wayne, Robert Ryan, Richard Burton, Henry Fonda,Action, Drama, History,39.10,G ,"57,380"
184,Bonnie and Clyde, Warren Beatty, Faye Dunaway, Michael J. Pollard, Gene Hackman,Action, Biography, Crime,Nan,R ,"116,393"
185,The French Connection, Gene Hackman, Roy Scheider, Fernando Rey, Tony Lo Bianco,Action, Crime, Drama,15.63,R ,"127,488"
186,Badlands, Martin Sheen, Sissy Spacek, Warren Oates, Ramon Bieri,Action, Crime, Drama,Nan,PG ,"75,235"
187,Ponniyin Selvan: Part I, Vikram, Aishwarya Rai Bachchan, Jayam Ravi, Karthi,Action, Adventure, Drama,Nan,Not Rated ,"33,459"
188,Kubo and the Two Strings, Charlize Theron, Art Parkinson, Matthew McConaughey, Ralph Fiennes,Animation, Action, Adventure,48.02,PG ,"133,493"
189,Run Lola Run, Franka Potente, Moritz Bleibtreu, Herbert Knaup, Nina Petri,Action, Crime, Thriller,7.27,R ,"202,245"
190,Key Largo, Humphrey Bogart, Edward G. Robinson, Lauren Bacall, Lionel Barrymore,Action, Crime, Drama,Nan,Not Rated ,"42,477"
191,The Man from Nowhere, Won Bin, Kim Sae-ron, Kim Tae-hoon, Kim Hee-won,Action, Crime, Drama,0.01,R ,"71,890"
192,Hard Boiled, Chow Yun-Fat, Tony Leung Chiu-wai, Teresa Mo, Philip Chan,Action, Crime, Thriller,Nan,R ,"52,086"
193,Scarface, Paul Muni, Ann Dvorak, Karen Morley, Osgood Perkins,Action, Crime, Drama,Nan,PG ,"29,062"
194,Joint Security Area, Lee Yeong-ae, Lee Byung-hun, Song Kang-ho, Kim Tae-woo,Action, Drama, Thriller,Nan,Not Rated ,"32,146"
195,Dragon Ball Super: Broly, Masako Nozawa, Aya Hisakawa, Ryô Horikawa, Toshio Furukawa,Animation, Action, Adventure,30.71,PG ,"29,388"
196,Eega, Sudeep, Nani, Samantha Ruth Prabhu, Hamsa Nandini,Action, Comedy, Drama,Nan,Not Rated ,"25,924"
197,Raazi, Alia Bhatt, Vicky Kaushal, Rajit Kapoor, Shishir Sharma,Action, Drama, Thriller,Nan,Not Rated ,"32,244"
198,Udta Punjab, Shahid Kapoor, Alia Bhatt, Kareena Kapoor, Diljit Dosanjh,Action, Crime, Drama,Nan,Not Rated ,"31,387"
199,Guy Ritchie's the Covenant, Jake Gyllenhaal, Dar Salim, Sean Sagar, Jason Wong,Action, Thriller, War,Nan,R ,"32,048"
200,Guardians of the Galaxy Vol, Chris Pratt, Zoe Saldana, Dave Bautista, Vin Diesel,Action, Adventure, Comedy,389.81,PG-13 ,"711,591"
201,Sicario, Emily Blunt, Josh Brolin, Benicio Del Toro, Jon Bernthal,Action, Crime, Drama,46.89,R ,"445,609"
202,The Fifth Element, Bruce Willis, Milla Jovovich, Gary Oldman, Ian Holm,Action, Adventure, Sci-Fi,63.54,PG-13 ,"485,585"
203,Deadpool 2, Ryan Reynolds, Josh Brolin, Morena Baccarin, Julian Dennison,Action, Adventure, Comedy,324.59,R ,"604,161"
204,Star Wars: Episode III - Revenge of the Sith, Hayden Christensen, Natalie Portman, Ewan McGregor, Samuel L. Jackson,Action, Adventure, Fantasy,380.26,PG-13 ,"810,988"
